{
  "$schema": "https://dsh-std.example/schemas/dsh-plugin/v0.15.json",
  "id": "com.example.better-sidebar",
  "name": "Better Sidebar",
  "version": "1.2.0",
  "manifestVersion": "0.15",
  "facets": {
    "host": { "entry": "dist/host.js", "apiVersion": "v1alpha1" }
  },
  "requires": {
    "contracts": [
      { "apiVersion": "storage.dsh/v1alpha1", "kind": "LocalStorage" },
      { "apiVersion": "messages.dsh/v1alpha1", "kind": "MessageObserver", "optional": true }
    ]
  },
  "permissions": [],
  "contributes": {
    "commands": [{ "id": "com.example.better-sidebar.toggle", "title": "Toggle Sidebar" }]
  },
  "subscriptions": ["messages.observe"]
}
